Platform,Title,Link,Rating,Reviews
tripadvisor.com,"THE 10 CLOSEST Hotels to Vabali Spa, Berlin",https://www.tripadvisor.com/HotelsNear-g187323-d6826032-Vabali_Spa-Berlin.html,,
booking.com,"AMERON Hotel Abion Spreebogen Berlin, Berlino (prezzi aggiornati ...",https://www.booking.com/hotel/de/abion-spreebogen-waterside.it.html,,
hotels.com,The Best Hotels in Berlin from CA $90 | Hotels.com,https://ca.hotels.com/de332483/berlin-germany-hotels-rooms/,,
expedia.com,"Myer's Hotel Berlin Reviews, Deals & Photos 2025 - Expedia",https://www.expedia.com/Berlin-Hotels-Myers-Hotel-Berlin.h2609982.Hotel-Information,,
agoda.com,"AMERON Hotel Abion Spreebogen Berlin , Berlin | 2025 Updated ...",https://www.agoda.com/abion-spreebogen-waterside-hotel/hotel/berlin-de.html,,
kayak.com,Mercure Hotel Moa Berlin from $67. Berlin Hotel Deals & Reviews ...,https://www.kayak.com/Berlin-Hotels-Mercure-Hotel-Moa-Berlin.2420620.ksp,,
trip.com,"10 Hotel Terbaik dekat Biesdorf, Berlin| Trip.com",https://id.trip.com/hotels/berlin-biesdorf/hotels-c193m17415237/,,
priceline.com,Hotel Deals in Berlin - Book Now from $38/night,https://www.priceline.com/hotel-deals/en-us/P3000035821/hotels-in-berlin.ssp,,
